{
  "catalogVersion": "ZODIAC_CATALOG_V1",
  "modelVersion": "FIXED_DATE_SINGLE_SIGN_V1",
  "dateRangeVersion": "ZODIAC_DATE_RANGE_V1",
  "scoreVersion": "SCORE_ZODIAC_V1",
  "source": "ZODIAC",
  "period": "LIFETIME",
  "productScope": "V1",
  "guardrail": "NO_SC07",
  "pairOverrides": [],
  "referenceTables": {
    "signs": [
      {
        "sign": "ARIES",
        "start": "03-21",
        "end": "04-19",
        "element": "FIRE",
        "modality": "CARDINAL",
        "polarity": "YANG",
        "opposite": "LIBRA"
      },
      {
        "sign": "TAURUS",
        "start": "04-20",
        "end": "05-20",
        "element": "EARTH",
        "modality": "FIXED",
        "polarity": "YIN",
        "opposite": "SCORPIO"
      },
      {
        "sign": "GEMINI",
        "start": "05-21",
        "end": "06-20",
        "element": "AIR",
        "modality": "MUTABLE",
        "polarity": "YANG",
        "opposite": "SAGITTARIUS"
      },
      {
        "sign": "CANCER",
        "start": "06-21",
        "end": "07-22",
        "element": "WATER",
        "modality": "CARDINAL",
        "polarity": "YIN",
        "opposite": "CAPRICORN"
      },
      {
        "sign": "LEO",
        "start": "07-23",
        "end": "08-22",
        "element": "FIRE",
        "modality": "FIXED",
        "polarity": "YANG",
        "opposite": "AQUARIUS"
      },
      {
        "sign": "VIRGO",
        "start": "08-23",
        "end": "09-22",
        "element": "EARTH",
        "modality": "MUTABLE",
        "polarity": "YIN",
        "opposite": "PISCES"
      },
      {
        "sign": "LIBRA",
        "start": "09-23",
        "end": "10-22",
        "element": "AIR",
        "modality": "CARDINAL",
        "polarity": "YANG",
        "opposite": "ARIES"
      },
      {
        "sign": "SCORPIO",
        "start": "10-23",
        "end": "11-21",
        "element": "WATER",
        "modality": "FIXED",
        "polarity": "YIN",
        "opposite": "TAURUS"
      },
      {
        "sign": "SAGITTARIUS",
        "start": "11-22",
        "end": "12-21",
        "element": "FIRE",
        "modality": "MUTABLE",
        "polarity": "YANG",
        "opposite": "GEMINI"
      },
      {
        "sign": "CAPRICORN",
        "start": "12-22",
        "end": "01-19",
        "element": "EARTH",
        "modality": "CARDINAL",
        "polarity": "YIN",
        "opposite": "CANCER"
      },
      {
        "sign": "AQUARIUS",
        "start": "01-20",
        "end": "02-18",
        "element": "AIR",
        "modality": "FIXED",
        "polarity": "YANG",
        "opposite": "LEO"
      },
      {
        "sign": "PISCES",
        "start": "02-19",
        "end": "03-20",
        "element": "WATER",
        "modality": "MUTABLE",
        "polarity": "YIN",
        "opposite": "VIRGO"
      }
    ]
  },
  "rules": [
    {
      "ruleId": "ZODIAC_SAME_SIGN_ATTRACTION",
      "source": "ZODIAC",
      "period": "LIFETIME",
      "relation": "SAME_SIGN",
      "category": "ATTRACTION",
      "signedValue": 0,
      "baseWeight": 1,
      "ruleConfidence": 0.75,
      "enabled": true,
      "productScope": "V1"
    },
    {
      "ruleId": "ZODIAC_SAME_SIGN_EMOTION",
      "source": "ZODIAC",
      "period": "LIFETIME",
      "relation": "SAME_SIGN",
      "category": "EMOTION",
      "signedValue": 0.25,
      "baseWeight": 1,
      "ruleConfidence": 0.75,
      "enabled": true,
      "productScope": "V1"
    },
    {
      "ruleId": "ZODIAC_SAME_SIGN_PASSION",
      "source": "ZODIAC",
      "period": "LIFETIME",
      "relation": "SAME_SIGN",
      "category": "PASSION",
      "signedValue": 0,
      "baseWeight": 1,
      "ruleConfidence": 0.75,
      "enabled": true,
      "productScope": "V1"
    },
    {
      "ruleId": "ZODIAC_SAME_SIGN_HARMONY",
      "source": "ZODIAC",
      "period": "LIFETIME",
      "relation": "SAME_SIGN",
      "category": "HARMONY",
      "signedValue": 0.15,
      "baseWeight": 1,
      "ruleConfidence": 0.75,
      "enabled": true,
      "productScope": "V1"
    },
    {
      "ruleId": "ZODIAC_OPPOSITE_SIGN_ATTRACTION",
      "source": "ZODIAC",
      "period": "LIFETIME",
      "relation": "OPPOSITE_SIGN",
      "category": "ATTRACTION",
      "signedValue": 0.5,
      "baseWeight": 1,
      "ruleConfidence": 0.75,
      "enabled": true,
      "productScope": "V1"
    },
    {
      "ruleId": "ZODIAC_OPPOSITE_SIGN_EMOTION",
      "source": "ZODIAC",
      "period": "LIFETIME",
      "relation": "OPPOSITE_SIGN",
      "category": "EMOTION",
      "signedValue": -0.2,
      "baseWeight": 1,
      "ruleConfidence": 0.75,
      "enabled": true,
      "productScope": "V1"
    },
    {
      "ruleId": "ZODIAC_OPPOSITE_SIGN_PASSION",
      "source": "ZODIAC",
      "period": "LIFETIME",
      "relation": "OPPOSITE_SIGN",
      "category": "PASSION",
      "signedValue": 0.4,
      "baseWeight": 1,
      "ruleConfidence": 0.75,
      "enabled": true,
      "productScope": "V1"
    },
    {
      "ruleId": "ZODIAC_OPPOSITE_SIGN_HARMONY",
      "source": "ZODIAC",
      "period": "LIFETIME",
      "relation": "OPPOSITE_SIGN",
      "category": "HARMONY",
      "signedValue": -0.25,
      "baseWeight": 1,
      "ruleConfidence": 0.75,
      "enabled": true,
      "productScope": "V1"
    },
    {
      "ruleId": "ZODIAC_SAME_ELEMENT_ATTRACTION",
      "source": "ZODIAC",
      "period": "LIFETIME",
      "relation": "SAME_ELEMENT",
      "category": "ATTRACTION",
      "signedValue": 0.25,
      "baseWeight": 1,
      "ruleConfidence": 0.75,
      "enabled": true,
      "productScope": "V1"
    },
    {
      "ruleId": "ZODIAC_SAME_ELEMENT_EMOTION",
      "source": "ZODIAC",
      "period": "LIFETIME",
      "relation": "SAME_ELEMENT",
      "category": "EMOTION",
      "signedValue": 0.3,
      "baseWeight": 1,
      "ruleConfidence": 0.75,
      "enabled": true,
      "productScope": "V1"
    },
    {
      "ruleId": "ZODIAC_SAME_ELEMENT_PASSION",
      "source": "ZODIAC",
      "period": "LIFETIME",
      "relation": "SAME_ELEMENT",
      "category": "PASSION",
      "signedValue": 0.15,
      "baseWeight": 1,
      "ruleConfidence": 0.75,
      "enabled": true,
      "productScope": "V1"
    },
    {
      "ruleId": "ZODIAC_SAME_ELEMENT_HARMONY",
      "source": "ZODIAC",
      "period": "LIFETIME",
      "relation": "SAME_ELEMENT",
      "category": "HARMONY",
      "signedValue": 0.35,
      "baseWeight": 1,
      "ruleConfidence": 0.75,
      "enabled": true,
      "productScope": "V1"
    },
    {
      "ruleId": "ZODIAC_COMPATIBLE_ELEMENT_ATTRACTION",
      "source": "ZODIAC",
      "period": "LIFETIME",
      "relation": "COMPATIBLE_ELEMENT",
      "category": "ATTRACTION",
      "signedValue": 0.35,
      "baseWeight": 1,
      "ruleConfidence": 0.75,
      "enabled": true,
      "productScope": "V1"
    },
    {
      "ruleId": "ZODIAC_COMPATIBLE_ELEMENT_EMOTION",
      "source": "ZODIAC",
      "period": "LIFETIME",
      "relation": "COMPATIBLE_ELEMENT",
      "category": "EMOTION",
      "signedValue": 0.2,
      "baseWeight": 1,
      "ruleConfidence": 0.75,
      "enabled": true,
      "productScope": "V1"
    },
    {
      "ruleId": "ZODIAC_COMPATIBLE_ELEMENT_PASSION",
      "source": "ZODIAC",
      "period": "LIFETIME",
      "relation": "COMPATIBLE_ELEMENT",
      "category": "PASSION",
      "signedValue": 0.25,
      "baseWeight": 1,
      "ruleConfidence": 0.75,
      "enabled": true,
      "productScope": "V1"
    },
    {
      "ruleId": "ZODIAC_COMPATIBLE_ELEMENT_HARMONY",
      "source": "ZODIAC",
      "period": "LIFETIME",
      "relation": "COMPATIBLE_ELEMENT",
      "category": "HARMONY",
      "signedValue": 0.25,
      "baseWeight": 1,
      "ruleConfidence": 0.75,
      "enabled": true,
      "productScope": "V1"
    },
    {
      "ruleId": "ZODIAC_CHALLENGING_ELEMENT_ATTRACTION",
      "source": "ZODIAC",
      "period": "LIFETIME",
      "relation": "CHALLENGING_ELEMENT",
      "category": "ATTRACTION",
      "signedValue": 0,
      "baseWeight": 1,
      "ruleConfidence": 0.75,
      "enabled": true,
      "productScope": "V1"
    },
    {
      "ruleId": "ZODIAC_CHALLENGING_ELEMENT_EMOTION",
      "source": "ZODIAC",
      "period": "LIFETIME",
      "relation": "CHALLENGING_ELEMENT",
      "category": "EMOTION",
      "signedValue": -0.25,
      "baseWeight": 1,
      "ruleConfidence": 0.75,
      "enabled": true,
      "productScope": "V1"
    },
    {
      "ruleId": "ZODIAC_CHALLENGING_ELEMENT_PASSION",
      "source": "ZODIAC",
      "period": "LIFETIME",
      "relation": "CHALLENGING_ELEMENT",
      "category": "PASSION",
      "signedValue": 0.05,
      "baseWeight": 1,
      "ruleConfidence": 0.75,
      "enabled": true,
      "productScope": "V1"
    },
    {
      "ruleId": "ZODIAC_CHALLENGING_ELEMENT_HARMONY",
      "source": "ZODIAC",
      "period": "LIFETIME",
      "relation": "CHALLENGING_ELEMENT",
      "category": "HARMONY",
      "signedValue": -0.3,
      "baseWeight": 1,
      "ruleConfidence": 0.75,
      "enabled": true,
      "productScope": "V1"
    }
  ]
}
